"Please enter the following information to create your account.","Molimo Vas popunite potrebne podatke kako biste se registrirali."
"Sign Up for Newsletter","Pretplati me na važne obavijesti"
"If you have an account with us, please log in.","Ako već imate korisnički račun kod nas, molimo Vas prijavite se."
"Registration is free and easy!","Prijava je besplatna i jednostavna!"
"Faster checkout","Brža naplata"
"Save multiple shipping addresses","Pohranite adrese pri kupnji"
"View and track orders and more","Prikaz i praćenje narudžbi i još mnogo toga"
"Forgot Your Password?","Zaboravili ste lozinku?"
"Forgot your password?","Zaboravili ste lozinku?"